number,value,datetime_start,datetime_complete,duration,params_bs,params_buf,params_discharge_price_factor,params_gamma,params_gs,params_lr,params_lstarts,params_n_layers,params_noise_sigma,params_noise_type,params_pi_l0,params_pi_l1,params_pi_l2,params_pi_l3,params_qf_l0,params_qf_l1,params_qf_l2,params_qf_l3,params_spawn_multiplier,params_tau,params_tf,params_transformer_max_power,user_attrs_yaml_path,state
0,6.498000914678414,2026-05-25 13:56:09.147081,2026-05-25 14:27:38.047140,0 days 00:31:28.900059,128,100000,1.2185299851677596,0.9064401077055427,4,2.644898018392709e-05,10000,3,0.4727745237038851,normal,64,128,64.0,,1024,1024,1024.0,,6,0.04093813608598782,4,300,results_ddpg_model1/optuna_phase2/trial_0.yaml,COMPLETE
1,-9.69804202094383,2026-05-25 14:27:38.049515,2026-05-25 14:59:01.537972,0 days 00:31:23.488457,128,1000000,0.822000429980714,0.935488107125883,4,1.5255188579331379e-05,5000,2,0.061438607034842836,normal,512,64,,,256,128,,,2,0.0015734685129393676,8,250,results_ddpg_model1/optuna_phase2/trial_1.yaml,COMPLETE
2,15.070445167570142,2026-05-25 14:59:01.539913,2026-05-25 15:33:32.075541,0 days 00:34:30.535628,256,100000,1.2266950337859277,0.9225655810916522,1,1.8733199637488447e-05,5000,2,0.17817822246986043,normal,128,1024,,,256,512,,,2,0.0053167142741246025,4,200,results_ddpg_model1/optuna_phase2/trial_2.yaml,COMPLETE
3,67.51203534917727,2026-05-25 15:33:32.077308,2026-05-25 16:09:41.090032,0 days 00:36:09.012724,512,1000000,1.4302926400143314,0.9670788718223859,4,0.00029087973697480173,5000,2,0.09189624551265466,normal,128,64,,,64,128,,,6,0.001067043743688687,1,250,results_ddpg_model1/optuna_phase2/trial_3.yaml,COMPLETE
4,10.025390016642632,2026-05-25 16:09:41.091928,2026-05-25 16:48:47.679216,0 days 00:39:06.587288,128,100000,1.474533983962477,0.9963280449204921,1,4.021535729341343e-05,1000,3,0.24268286674279144,ou,256,512,256.0,,1024,1024,64.0,,6,0.004654373626005677,8,300,results_ddpg_model1/optuna_phase2/trial_4.yaml,COMPLETE
5,-14.537803197803441,2026-05-25 16:48:47.681128,2026-05-25 17:17:46.010328,0 days 00:28:58.329200,512,1000000,0.8889423588563194,0.9858401595394303,8,0.001015661776986701,5000,2,0.42017025229684624,ou,128,64,,,64,1024,,,3,0.03560969923212882,1,200,results_ddpg_model1/optuna_phase2/trial_5.yaml,COMPLETE
6,0.5460772477090359,2026-05-25 17:17:46.012500,2026-05-25 17:47:47.642921,0 days 00:30:01.630421,128,1000000,1.0717189483445653,0.9469432090796452,8,0.0005534085180686906,10000,4,0.4731036086412309,ou,128,512,128.0,128.0,1024,256,1024.0,1024.0,4,0.0014662813285223888,4,250,results_ddpg_model1/optuna_phase2/trial_6.yaml,COMPLETE
7,-3.128782730709645,2026-05-25 17:47:47.645061,2026-05-25 18:13:49.233586,0 days 00:26:01.588525,128,500000,1.0052475401886452,0.9337395504850488,8,0.0008380482962434941,10000,3,0.33432674547640967,normal,512,64,512.0,,64,64,256.0,,4,0.038135441400524966,8,150,results_ddpg_model1/optuna_phase2/trial_7.yaml,COMPLETE
8,13.535141925909556,2026-05-25 18:13:49.237172,2026-05-25 18:43:06.888587,0 days 00:29:17.651415,512,500000,1.1181787453374412,0.9116350984309334,1,1.969365773412287e-05,10000,4,0.33322938716086814,normal,128,512,256.0,512.0,256,256,1024.0,128.0,5,0.012676192618484725,4,250,results_ddpg_model1/optuna_phase2/trial_8.yaml,COMPLETE
9,-4.163981055578915,2026-05-25 18:43:06.889925,2026-05-25 19:15:16.748353,0 days 00:32:09.858428,128,100000,1.1153808947170654,0.9372698733209269,1,1.162289174829428e-05,1000,3,0.43234132580483514,ou,512,128,1024.0,,512,512,256.0,,3,0.02382899882822886,4,100,results_ddpg_model1/optuna_phase2/trial_9.yaml,COMPLETE
10,23.47383505871403,2026-05-25 19:15:16.751340,2026-05-25 19:46:48.951505,0 days 00:31:32.200165,1024,1000000,1.4885055351530108,0.9647832757543046,4,0.0002129275155049955,5000,2,0.06399317132304497,normal,1024,256,,,128,128,,,5,0.0010434919455005666,1,150,results_ddpg_model1/optuna_phase2/trial_10.yaml,COMPLETE
11,18.517442282070988,2026-05-25 19:46:48.954736,2026-05-25 20:19:03.622933,0 days 00:32:14.668197,1024,1000000,1.498186762748273,0.9669862131612456,4,0.00019375064903165364,5000,2,0.06149727266474439,normal,1024,256,,,128,128,,,5,0.0011404110350940046,1,150,results_ddpg_model1/optuna_phase2/trial_11.yaml,COMPLETE
12,18.68902050986071,2026-05-25 20:19:03.625345,2026-05-25 20:51:13.092037,0 days 00:32:09.466692,1024,1000000,1.378504359551811,0.9647971241499925,4,0.0002068514761435546,5000,2,0.1307999515620549,normal,1024,256,,,128,128,,,5,0.0021273497245954823,1,100,results_ddpg_model1/optuna_phase2/trial_12.yaml,COMPLETE
13,12.510642155892128,2026-05-25 20:51:13.093338,2026-05-25 21:23:27.717356,0 days 00:32:14.624018,1024,1000000,1.3137864088633608,0.9650573851284285,4,0.002214882069253618,5000,2,0.14261334965002342,normal,1024,256,,,64,128,,,6,0.0027818220692682936,1,150,results_ddpg_model1/optuna_phase2/trial_13.yaml,COMPLETE
14,27.361480650200974,2026-05-25 21:23:27.719251,2026-05-25 21:53:40.820325,0 days 00:30:13.101074,512,1000000,1.4005367204824823,0.9558334952031219,4,8.042901987884138e-05,5000,2,0.05350225399487,normal,64,1024,,,128,128,,,5,0.001162646709974328,1,200,results_ddpg_model1/optuna_phase2/trial_14.yaml,COMPLETE
15,55.39336464635733,2026-05-25 21:53:40.823304,2026-05-25 22:35:06.711878,0 days 00:41:25.888574,512,1000000,1.3438476132864694,0.9508318294405798,4,7.353058390980673e-05,5000,3,0.11664334818187873,normal,64,1024,512.0,,512,64,128.0,,6,0.0027261458947450638,1,250,results_ddpg_model1/optuna_phase2/trial_15.yaml,COMPLETE
16,10.34329107493977,2026-05-25 22:35:06.713623,2026-05-25 23:20:49.737438,0 days 00:45:43.023815,512,500000,1.3060248960379222,0.9779288369687916,4,7.163182659416142e-05,1000,4,0.19172434243153955,normal,64,1024,512.0,256.0,512,64,128.0,64.0,6,0.0028497869718721812,1,250,results_ddpg_model1/optuna_phase2/trial_16.yaml,COMPLETE
17,61.56861211524574,2026-05-25 23:20:49.739707,2026-05-26 00:01:56.136854,0 days 00:41:06.397147,512,1000000,1.3866670574447069,0.9473246809691281,4,0.00010679673636938856,5000,3,0.1208017672647672,normal,256,64,512.0,,512,64,128.0,,6,0.002069336743606746,1,300,results_ddpg_model1/optuna_phase2/trial_17.yaml,COMPLETE
18,-1.9396429175976664,2026-05-26 00:01:56.141294,2026-05-26 00:44:56.114023,0 days 00:42:59.972729,256,1000000,1.4107723890183321,0.9770700586114478,4,0.0004118198419022228,5000,4,0.22209482885968804,ou,256,64,128.0,64.0,512,64,512.0,256.0,4,0.001968931916366532,1,300,results_ddpg_model1/optuna_phase2/trial_18.yaml,COMPLETE
19,-0.7943404879188165,2026-05-26 00:44:56.116791,2026-05-26 01:26:53.881064,0 days 00:41:57.764273,512,500000,1.2399688260812007,0.9471620682426558,8,0.00011280809655560976,1000,3,0.1098844660830581,normal,256,64,64.0,,64,64,128.0,,6,0.003961552857406852,1,300,results_ddpg_model1/optuna_phase2/trial_19.yaml,COMPLETE
20,11.225263187250675,2026-05-26 01:26:53.884651,2026-05-26 01:55:14.239355,0 days 00:28:20.354704,512,1000000,1.4361903386411674,0.955945588195026,4,0.0003533523195047855,5000,3,0.16568141932863695,normal,256,64,1024.0,,64,512,64.0,,3,0.008290509177613698,8,300,results_ddpg_model1/optuna_phase2/trial_20.yaml,COMPLETE
21,54.48282509515957,2026-05-26 01:55:14.242209,2026-05-26 02:24:14.193397,0 days 00:28:59.951188,512,1000000,1.3317040495285626,0.9524862714054708,4,4.671560442873568e-05,5000,3,0.11006312096192106,normal,64,1024,512.0,,512,64,128.0,,6,0.0024846529663299015,1,250,results_ddpg_model1/optuna_phase2/trial_21.yaml,COMPLETE
22,50.21679046904319,2026-05-26 02:24:14.195548,2026-05-26 02:52:35.100503,0 days 00:28:20.904955,512,1000000,1.3585196626048615,0.9433174644503702,4,0.0001277226208057537,5000,3,0.10595134110899793,normal,128,64,512.0,,512,64,128.0,,6,0.001661994133395716,1,250,results_ddpg_model1/optuna_phase2/trial_22.yaml,COMPLETE
23,32.13793023471953,2026-05-26 02:52:35.102549,2026-05-26 03:26:50.194368,0 days 00:34:15.091819,512,1000000,1.430003626373823,0.9265882374659845,4,7.059757409838246e-05,5000,4,0.15578504940473895,normal,64,1024,512.0,1024.0,512,64,128.0,512.0,5,0.003449384210798752,1,200,results_ddpg_model1/optuna_phase2/trial_23.yaml,COMPLETE
24,53.28315751748596,2026-05-26 03:26:50.197803,2026-05-26 04:00:12.587126,0 days 00:33:22.389323,512,1000000,1.3527940438988613,0.9569905690041935,4,0.00011463754140418985,5000,3,0.09423942997719661,normal,256,64,512.0,,512,64,512.0,,6,0.0021373477278167027,1,300,results_ddpg_model1/optuna_phase2/trial_24.yaml,COMPLETE
25,2.5637542562326416,2026-05-26 04:00:12.589776,2026-05-26 04:35:16.344735,0 days 00:35:03.754959,256,1000000,1.2849949412183468,0.9429267548993135,4,0.0002598726873787831,5000,3,0.2003615230849261,normal,256,128,512.0,,512,256,128.0,,5,0.0015679685956581436,1,250,results_ddpg_model1/optuna_phase2/trial_25.yaml,COMPLETE
26,49.841529279588485,2026-05-26 04:35:16.347215,2026-05-26 05:12:14.509476,0 days 00:36:58.162261,512,1000000,1.430616556857746,0.9495116958474366,4,0.00014911582080506173,5000,4,0.1414970531286731,ou,128,1024,512.0,64.0,64,64,128.0,1024.0,6,0.003110135407145072,1,300,results_ddpg_model1/optuna_phase2/trial_26.yaml,COMPLETE
27,21.968043997148925,2026-05-26 05:12:14.513883,2026-05-26 05:51:21.846338,0 days 00:39:07.332455,512,1000000,1.3817090722594183,0.9728100088389623,4,4.590958565132796e-05,5000,3,0.17492588613326993,normal,64,64,128.0,,512,64,128.0,,5,0.0012928155359327536,1,250,results_ddpg_model1/optuna_phase2/trial_27.yaml,COMPLETE
28,18.07470364496112,2026-05-26 05:51:21.849276,2026-05-26 06:28:48.207624,0 days 00:37:26.358348,512,500000,1.2742124769403562,0.9559611846878502,1,9.128307300667173e-05,10000,2,0.10003512448474214,normal,64,64,,,512,128,,,6,0.0019416790114198793,8,200,results_ddpg_model1/optuna_phase2/trial_28.yaml,COMPLETE
29,1.00750583660556,2026-05-26 06:28:48.211938,2026-05-26 07:14:14.657787,0 days 00:45:26.445849,512,100000,1.1850926303465197,0.9597546831767759,8,3.676058982941531e-05,1000,3,0.1340161236187191,normal,256,128,64.0,,1024,1024,64.0,,6,0.0026317463658231065,1,300,results_ddpg_model1/optuna_phase2/trial_29.yaml,COMPLETE
