number,value,datetime_start,datetime_complete,duration,params_bs,params_buf,params_gamma,params_gs,params_lr,params_lstarts,params_n_layers,params_noise_sigma,params_noise_type,params_pd,params_pi_l0,params_pi_l1,params_pi_l2,params_pi_l3,params_qf_l0,params_qf_l1,params_qf_l2,params_qf_l3,params_tau,params_tf,params_tnc,params_tpn,state
0,6.375611619150732,2026-05-24 21:38:50.146286,2026-05-24 22:23:52.769961,0 days 00:45:02.623675,128,100000,0.9064401077055427,4,2.644898018392709e-05,10000,3,0.13819228808861533,normal,1,64,128,64.0,,1024,1024,1024.0,,0.04093813608598782,4,0.7185299851677596,0.4579309401710595,COMPLETE
1,-0.569369086122606,2026-05-24 22:23:52.772580,2026-05-24 22:52:34.919132,0 days 00:28:42.146552,128,1000000,0.9854472391616838,4,1.936518766909304e-05,10000,2,0.16218150311699372,ou,2,512,512,,,64,256,,,0.011454201562599395,8,0.5200491867534287,0.3545641645055122,COMPLETE
2,-14.100647644713035,2026-05-24 22:52:34.921886,2026-05-24 23:27:08.973842,0 days 00:34:34.051956,128,1000000,0.9359993306355501,4,0.0005513954848805307,1000,3,0.29109860783364133,ou,2,64,64,1024.0,,1024,64,256.0,,0.04477427984113197,1,0.5574481929034772,0.3912865394447439,COMPLETE
3,0.22839215898420662,2026-05-24 23:27:08.977482,2026-05-24 23:56:21.710864,0 days 00:29:12.733382,1024,100000,0.9809049978199204,8,0.00043138049872830825,10000,2,0.36135283896171194,ou,1,64,64,,,512,256,,,0.008775452610882301,1,0.30354310869235307,0.3654007076432223,COMPLETE
4,-4.237871940626064,2026-05-24 23:56:21.713344,2026-05-25 00:19:28.763473,0 days 00:23:07.050129,256,1000000,0.901530205036358,8,8.259009849110666e-05,10000,3,0.18211632991902205,normal,3,1024,128,512.0,,64,256,512.0,,0.03777334039373524,1,0.7879110186966876,0.39630744710168175,COMPLETE
5,-19.46002610695416,2026-05-25 00:19:28.769958,2026-05-25 00:47:14.567113,0 days 00:27:45.797155,128,1000000,0.9025097235981303,1,1.5643933810778685e-05,1000,4,0.36664603672101065,ou,2,256,1024,512.0,512.0,128,64,1024.0,256.0,0.043202689245205685,1,0.3322018494152269,0.1464290562027665,COMPLETE
6,-17.96312461385969,2026-05-25 00:47:14.570675,2026-05-25 01:11:45.059293,0 days 00:24:30.488618,256,100000,0.9099770221363652,1,1.4853074269608514e-05,10000,3,0.4688407965216041,normal,3,128,256,256.0,,1024,256,256.0,,0.0010738863822479564,4,0.5604126600549482,0.26504707076457057,COMPLETE
7,-17.251995007918595,2026-05-25 01:11:45.062281,2026-05-25 01:44:33.778944,0 days 00:32:48.716663,256,1000000,0.9699179804884931,1,0.0010860430013475597,1000,4,0.3125159442937218,ou,2,1024,512,1024.0,64.0,512,512,64.0,512.0,0.0013747038159517234,1,0.3822683727439734,0.14752716650722877,COMPLETE
8,-2.922966562327929,2026-05-25 01:44:33.782899,2026-05-25 02:14:39.415246,0 days 00:30:05.632347,128,100000,0.9901817912648904,4,2.5282608333658264e-05,10000,4,0.4998729529787588,normal,1,1024,128,64.0,128.0,512,128,1024.0,512.0,0.024972734685483382,1,0.33946284765564894,0.20936282877228252,COMPLETE
9,4.357794437426492,2026-05-25 02:14:39.418212,2026-05-25 02:41:25.303551,0 days 00:26:45.885339,256,500000,0.9853740071659278,8,0.0003475235079419189,5000,4,0.0683908773199155,ou,3,256,256,64.0,512.0,128,64,256.0,64.0,0.04103997221653117,4,0.767290416964719,0.28958465610514894,COMPLETE
10,-3.6235815597437977,2026-05-25 02:41:25.306498,2026-05-25 03:07:51.620180,0 days 00:26:26.313682,512,500000,0.9255347683075477,4,8.75047795161457e-05,5000,2,0.05638650363117326,normal,1,64,128,,,256,1024,,,0.016747967963595876,4,0.9548933132569972,0.4975616548305801,COMPLETE
11,0.9885470437584445,2026-05-25 03:07:51.622784,2026-05-25 03:32:48.425932,0 days 00:24:56.803148,1024,500000,0.9592003326884481,8,0.0025724734062929208,5000,3,0.05337341764601272,normal,3,256,256,64.0,,128,1024,128.0,,0.016204249807206632,4,0.7512715796876599,0.298834157444341,COMPLETE
12,2.531581165550506,2026-05-25 03:32:48.428825,2026-05-25 04:00:30.748602,0 days 00:27:42.319777,512,500000,0.9508722363499911,8,0.0001741448623730821,5000,4,0.13236485128269812,normal,3,256,256,128.0,512.0,1024,1024,256.0,64.0,0.02420829452468093,4,0.7317426943349755,0.48980869779369135,COMPLETE
13,0.8770888897997793,2026-05-25 04:00:30.750444,2026-05-25 04:35:20.955001,0 days 00:34:50.204557,256,500000,0.9988260625972104,4,4.238870992992018e-05,5000,3,0.20740575418850768,ou,1,512,1024,64.0,,128,64,1024.0,,0.0035014473580334093,4,0.853308078928068,0.23625743130359297,COMPLETE
14,-1.2480069564044243,2026-05-25 04:35:20.956896,2026-05-25 05:08:42.707113,0 days 00:33:21.750217,256,100000,0.938185617616993,8,0.0002271377744496886,5000,4,0.1086685349992905,ou,3,128,256,64.0,1024.0,256,128,64.0,64.0,0.04878822594219519,8,0.6664272168716121,0.4264512590424534,COMPLETE
15,5.444294437300414,2026-05-25 05:08:42.709494,2026-05-25 05:45:30.427059,0 days 00:36:47.717565,128,500000,0.9631244163783521,4,6.649699546163524e-05,10000,3,0.22356376795152524,normal,1,256,128,64.0,,1024,512,128.0,,0.025424393512565098,4,0.8590187629424957,0.3223549809883675,COMPLETE
16,2.190707087283954,2026-05-25 05:45:30.432723,2026-05-25 06:19:36.584314,0 days 00:34:06.151591,128,100000,0.9645892905056284,4,5.207545437663346e-05,10000,3,0.23108002900292945,normal,1,64,128,256.0,,1024,512,128.0,,0.006388912320935328,4,0.9040257117465065,0.32777496403171896,COMPLETE
17,0.46530082647223026,2026-05-25 06:19:36.586052,2026-05-25 06:58:28.801629,0 days 00:38:52.215577,128,100000,0.919252188109437,4,1.0718085131194974e-05,10000,2,0.23859035789358587,normal,1,256,128,,,1024,512,,,0.024059895290151595,4,0.9644346699388585,0.43312703989230894,COMPLETE
18,1.3330150360707194,2026-05-25 06:58:28.803907,2026-05-25 07:34:19.924809,0 days 00:35:51.120902,128,500000,0.9438671893587048,4,3.6154625104503946e-05,10000,3,0.14011750772186404,normal,1,64,128,128.0,,1024,512,128.0,,0.02995296855856434,8,0.8414003722343271,0.4465189389535331,COMPLETE
19,8.33056914138433,2026-05-25 07:34:19.926946,2026-05-25 08:03:18.467268,0 days 00:28:58.540322,128,100000,0.9281569755288416,4,0.00010083400995260373,10000,3,0.19293815988402518,normal,1,512,128,64.0,,1024,1024,512.0,,0.014299704811543768,4,0.6759203088846366,0.33785767184457743,COMPLETE
20,-1.8400968295827624,2026-05-25 08:03:18.469636,2026-05-25 08:28:41.301991,0 days 00:25:22.832355,1024,100000,0.9217772990872295,4,0.00011542206290398101,10000,2,0.18015274022341685,normal,1,512,128,,,1024,1024,,,0.015139469402059277,4,0.6813772408595675,0.4608964640315701,COMPLETE
21,12.013206806368544,2026-05-25 08:28:41.304191,2026-05-25 09:00:29.986136,0 days 00:31:48.681945,128,100000,0.9283240847073506,4,5.028942443970353e-05,10000,3,0.23898533850857423,normal,1,512,128,64.0,,1024,1024,512.0,,0.02715435879998411,4,0.8337350524734669,0.3338530040594196,COMPLETE
22,10.777244767989032,2026-05-25 09:00:29.988883,2026-05-25 09:37:28.643727,0 days 00:36:58.654844,128,100000,0.929823744691615,4,3.2776009817279225e-05,10000,3,0.11580387267907515,normal,1,512,128,64.0,,1024,1024,512.0,,0.02896873210543988,4,0.6398035064065695,0.36302297735444833,COMPLETE
23,8.478850104787853,2026-05-25 09:37:28.645851,2026-05-25 10:11:47.055101,0 days 00:34:18.409250,128,100000,0.9305897492736638,4,4.5531413502669403e-05,10000,3,0.10006175999719971,normal,1,512,128,64.0,,1024,1024,512.0,,0.018566195017470713,4,0.6094798963709763,0.35951887370833135,COMPLETE
24,0.7713771123671904,2026-05-25 10:11:47.065319,2026-05-25 10:48:39.031684,0 days 00:36:51.966365,512,100000,0.9330906717150775,4,4.1417886616412876e-05,10000,3,0.09030664777460193,normal,1,512,128,64.0,,64,1024,512.0,,0.01921280505888096,4,0.6123819338514436,0.3793128329416426,COMPLETE
25,10.238484500841878,2026-05-25 10:48:39.034050,2026-05-25 11:28:40.589946,0 days 00:40:01.555896,128,100000,0.9150782738453199,1,5.9736567139556704e-05,1000,3,0.09206596154949746,normal,1,512,64,64.0,,1024,1024,512.0,,0.030969312388574425,8,0.622666774761427,0.4030383684772592,COMPLETE
26,6.459666593931615,2026-05-25 11:28:40.592039,2026-05-25 12:06:51.491791,0 days 00:38:10.899752,128,100000,0.9135190139426685,1,6.1030082252563305e-05,1000,2,0.11270161827329066,normal,1,512,64,,,256,1024,,,0.032659560708565016,8,0.9949593411176784,0.3997230831109206,COMPLETE
27,4.235673005634453,2026-05-25 12:06:51.495213,2026-05-25 12:49:51.252347,0 days 00:42:59.757134,128,100000,0.9161071820851533,1,2.8194234475534873e-05,1000,3,0.1528324812423515,normal,1,512,64,128.0,,1024,1024,512.0,,0.02862085666991704,8,0.7813993206644398,0.41500029911445313,COMPLETE
28,8.529709234426264,2026-05-25 12:49:51.253779,2026-05-25 13:33:21.647711,0 days 00:43:30.393932,128,100000,0.9209131322396182,1,0.00012913954550898104,1000,3,0.09346554715574992,normal,1,512,64,64.0,,1024,128,512.0,,0.03285508816642571,8,0.48592680256539844,0.37042562842921095,COMPLETE
29,6.685717222513631,2026-05-25 13:33:21.650091,2026-05-25 14:09:42.881697,0 days 00:36:21.231606,128,100000,0.910916169950635,1,3.009908182729942e-05,1000,4,0.13027138348369796,normal,1,512,1024,256.0,256.0,1024,1024,512.0,128.0,0.020971844976136383,8,0.7057763349978077,0.3413167888341971,COMPLETE
