number,value,datetime_start,datetime_complete,duration,params_bs,params_buf,params_discharge_price_factor,params_gamma,params_gs,params_lr,params_lstarts,params_n_layers,params_noise_sigma,params_noise_type,params_pd,params_pi_l0,params_pi_l1,params_pi_l2,params_pi_l3,params_qf_l0,params_qf_l1,params_qf_l2,params_qf_l3,params_spawn_multiplier,params_tau,params_tf,params_tnc,params_tpn,params_transformer_max_power,user_attrs_yaml_path,state
0,4.390025866247015,2026-05-25 14:09:43.157830,2026-05-25 14:45:01.861141,0 days 00:35:18.703311,128,100000,1.027731231534285,0.9064401077055427,4,2.644898018392709e-05,10000,3,0.13819228808861533,normal,1,64,128,64.0,,1024,1024,1024.0,,2,0.04093813608598782,4,0.7185299851677596,0.4579309401710595,150,results_td3_model1/optuna_phase2/trial_0.yaml,COMPLETE
1,2.508709585526958,2026-05-25 14:45:01.864622,2026-05-25 15:17:45.874631,0 days 00:32:44.010009,1024,1000000,1.0028260170396377,0.9062922766783164,4,6.601984958164861e-05,10000,2,0.1529591744712301,ou,1,64,256,,,128,512,,,2,0.0033755895712060846,4,0.4745045604042124,0.4630265895704372,100,results_td3_model1/optuna_phase2/trial_1.yaml,COMPLETE
2,-8.394365145621123,2026-05-25 15:17:45.877187,2026-05-25 15:54:34.182162,0 days 00:36:48.304975,256,1000000,0.8794314648684124,0.9975793949569495,4,0.00016309244205756727,10000,4,0.11188442486569697,ou,3,256,512,1024.0,128.0,128,128,512.0,256.0,3,0.002577772852685676,1,0.7836564166717261,0.16974657160199658,300,results_td3_model1/optuna_phase2/trial_2.yaml,COMPLETE
3,25.26281257113442,2026-05-25 15:54:34.185090,2026-05-25 16:31:11.608327,0 days 00:36:37.423237,256,500000,1.3957956700618,0.9241549746945293,4,4.53877257250326e-05,5000,4,0.18250200143131357,normal,3,256,512,512.0,1024.0,512,256,512.0,64.0,3,0.044989974439518646,4,0.9766583733305687,0.2712736593269257,150,results_td3_model1/optuna_phase2/trial_3.yaml,COMPLETE
4,18.890203519666102,2026-05-25 16:31:11.611944,2026-05-25 16:59:19.722862,0 days 00:28:08.110918,512,1000000,1.2462009310487445,0.9790312227177107,4,0.00017470956128610494,10000,2,0.2891095842056666,normal,3,128,128,,,64,512,,,4,0.01271361987471578,4,0.7360233330733001,0.1863284109987373,250,results_td3_model1/optuna_phase2/trial_4.yaml,COMPLETE
5,-18.127389253873844,2026-05-25 16:59:19.725161,2026-05-25 17:27:55.155044,0 days 00:28:35.429883,512,1000000,0.8498320539221603,0.9044850969674324,8,0.0003742863434150556,10000,4,0.09249933234016777,normal,2,256,256,1024.0,512.0,128,64,64.0,1024.0,5,0.004329677966181862,8,0.3485529106126158,0.1783164539157186,150,results_td3_model1/optuna_phase2/trial_5.yaml,COMPLETE
6,47.097890110733715,2026-05-25 17:27:55.157687,2026-05-25 17:57:50.547783,0 days 00:29:55.390096,128,500000,1.4630740041687011,0.9665793271516268,8,6.518413863813437e-05,1000,4,0.2167889661801009,normal,2,128,128,512.0,512.0,1024,512,1024.0,64.0,6,0.018978494465076153,4,0.35938639985963433,0.13253951225675992,300,results_td3_model1/optuna_phase2/trial_6.yaml,COMPLETE
7,-19.33648714714218,2026-05-25 17:57:50.551065,2026-05-25 18:25:23.897635,0 days 00:27:33.346570,128,500000,1.0635243568146349,0.9881361146052007,8,0.0022609163158429113,5000,4,0.07034840154778524,normal,2,256,64,1024.0,128.0,512,256,64.0,256.0,2,0.005944935612037232,8,0.5927701254034332,0.345366078374316,300,results_td3_model1/optuna_phase2/trial_7.yaml,COMPLETE
8,-0.5585441160583287,2026-05-25 18:25:23.900842,2026-05-25 19:01:32.013460,0 days 00:36:08.112618,1024,1000000,0.8902158053374545,0.9697038970418231,1,0.0003440186396263576,10000,4,0.1580655284501869,ou,1,512,64,256.0,128.0,128,512,256.0,64.0,2,0.0023004866767875843,8,0.6448326657950088,0.49201303011419084,100,results_td3_model1/optuna_phase2/trial_8.yaml,COMPLETE
9,-9.674565147637622,2026-05-25 19:01:32.015173,2026-05-25 19:25:21.714610,0 days 00:23:49.699437,512,500000,0.9884702616645666,0.9791416294919952,4,1.2513561638313206e-05,10000,2,0.2896777699047604,ou,3,1024,128,,,128,1024,,,3,0.011662292440045782,4,0.672479439685721,0.30467097684626643,150,results_td3_model1/optuna_phase2/trial_9.yaml,COMPLETE
10,23.557942996441852,2026-05-25 19:25:21.716410,2026-05-25 19:57:48.671555,0 days 00:32:26.955145,128,100000,1.499135128001948,0.95420826586597,8,1.1184694165779915e-05,1000,3,0.4079371289099041,normal,2,128,1024,512.0,,1024,128,1024.0,,6,0.0010493401925064196,1,0.3099345612040473,0.10435039570142018,250,results_td3_model1/optuna_phase2/trial_10.yaml,COMPLETE
11,18.191913533286424,2026-05-25 19:57:48.673438,2026-05-25 20:30:29.819332,0 days 00:32:41.145894,256,500000,1.4551841550787223,0.9379210163447053,1,4.365794624899067e-05,1000,3,0.2158627433417486,normal,2,128,512,512.0,,256,256,512.0,,6,0.03728336065802525,4,0.9924660922052069,0.24916060312310387,200,results_td3_model1/optuna_phase2/trial_11.yaml,COMPLETE
12,-1.3745851058047265,2026-05-25 20:30:29.822206,2026-05-25 21:02:31.101824,0 days 00:32:01.279618,256,500000,1.3593042376995563,0.9306589086596035,8,5.463733879119013e-05,5000,4,0.2262444013546485,normal,3,1024,512,128.0,1024.0,512,256,128.0,64.0,4,0.02277942533664579,4,0.9563221078188877,0.10174818449344042,200,results_td3_model1/optuna_phase2/trial_12.yaml,COMPLETE
13,29.8432954485761,2026-05-25 21:02:31.105055,2026-05-25 21:36:22.551028,0 days 00:33:51.445973,128,500000,1.3196389256178085,0.9576897603833073,8,2.5849850334522294e-05,1000,4,0.347759093705479,normal,2,512,1024,512.0,256.0,1024,64,1024.0,64.0,5,0.045965280640117914,4,0.8583713113327363,0.26620654289682694,250,results_td3_model1/optuna_phase2/trial_13.yaml,COMPLETE
14,27.611892533954233,2026-05-25 21:36:22.554479,2026-05-25 22:12:52.909009,0 days 00:36:30.354530,128,500000,1.3094162875698474,0.9581345394262025,8,2.0921637733440832e-05,1000,3,0.36046747473807017,normal,2,512,1024,512.0,,1024,64,1024.0,,5,0.022266188635073323,4,0.45503930613469384,0.35017901378174743,250,results_td3_model1/optuna_phase2/trial_14.yaml,COMPLETE
15,27.06851687002927,2026-05-25 22:12:52.912535,2026-05-25 22:56:19.262548,0 days 00:43:26.350013,128,500000,1.2679164993752936,0.9640889036095125,8,2.1942875985549402e-05,1000,4,0.495535669876215,normal,2,512,1024,512.0,256.0,1024,64,1024.0,512.0,5,0.024218219233656177,1,0.859844883658925,0.22592025229984394,300,results_td3_model1/optuna_phase2/trial_15.yaml,COMPLETE
16,22.47934050830372,2026-05-25 22:56:19.264290,2026-05-25 23:36:02.076029,0 days 00:39:42.811739,128,500000,1.211489283343336,0.9479072027779188,8,9.663541588169173e-05,1000,3,0.33010447095095324,normal,2,512,128,128.0,,1024,512,1024.0,,6,0.01320226916390952,4,0.8567578138826749,0.14470657122107536,250,results_td3_model1/optuna_phase2/trial_16.yaml,COMPLETE
17,24.34189879987389,2026-05-25 23:36:02.080116,2026-05-26 00:18:31.199747,0 days 00:42:29.119631,128,100000,1.4060633324965237,0.945779155753284,1,1.0100940529191047e-05,1000,4,0.2381178274351083,normal,2,128,1024,256.0,64.0,256,64,128.0,128.0,5,0.02822282380451667,4,0.5491462222706069,0.21954611947942798,300,results_td3_model1/optuna_phase2/trial_17.yaml,COMPLETE
18,21.671795353875495,2026-05-26 00:18:31.204565,2026-05-26 00:59:46.885045,0 days 00:41:15.680480,128,500000,1.3470470971625557,0.9670789382075289,8,3.0093722142148788e-05,1000,4,0.25397309139284957,ou,2,128,1024,64.0,256.0,64,512,256.0,64.0,6,0.048982036666121304,1,0.4345498343431448,0.14003777213008045,250,results_td3_model1/optuna_phase2/trial_18.yaml,COMPLETE
19,10.648639223561986,2026-05-26 00:59:46.888139,2026-05-26 01:36:38.187839,0 days 00:36:51.299700,1024,500000,1.1741347356307223,0.9578164135720013,8,9.137001062620594e-05,1000,3,0.20712793848777777,normal,2,512,128,512.0,,1024,64,1024.0,,5,0.016824479468493872,8,0.5523669013669575,0.2098068556674284,300,results_td3_model1/optuna_phase2/trial_19.yaml,COMPLETE
20,37.75527270983366,2026-05-26 01:36:38.191211,2026-05-26 02:11:51.264354,0 days 00:35:13.073143,128,100000,1.4469193840635313,0.9723671062949596,8,1.836417897803351e-05,1000,4,0.27605373573123915,normal,1,1024,256,512.0,512.0,1024,1024,1024.0,64.0,4,0.00913598072226967,4,0.38831209921787124,0.26559880981620776,200,results_td3_model1/optuna_phase2/trial_20.yaml,COMPLETE
21,45.15872975867569,2026-05-26 02:11:51.267045,2026-05-26 02:47:31.084387,0 days 00:35:39.817342,128,100000,1.4967199641380289,0.9701836700382866,8,1.8876988444711724e-05,1000,4,0.2820581075450497,normal,1,1024,256,512.0,512.0,1024,1024,1024.0,64.0,4,0.008508843854281878,4,0.38403727361316686,0.2720146574849972,200,results_td3_model1/optuna_phase2/trial_21.yaml,COMPLETE
22,45.90728529291954,2026-05-26 02:47:31.087110,2026-05-26 03:26:44.103215,0 days 00:39:13.016105,128,100000,1.4901953001456687,0.9753515641501826,8,1.700061811129262e-05,1000,4,0.27444610600813524,normal,1,1024,256,512.0,512.0,1024,1024,1024.0,64.0,4,0.006405605648354765,4,0.3809472270735747,0.30295015572242806,200,results_td3_model1/optuna_phase2/trial_22.yaml,COMPLETE
23,39.69202076936911,2026-05-26 03:26:44.106028,2026-05-26 04:07:58.157132,0 days 00:41:14.051104,128,100000,1.4984269827943495,0.9772425781218964,8,1.5062783973172937e-05,1000,4,0.18903991137497117,normal,1,1024,256,512.0,512.0,1024,1024,1024.0,64.0,4,0.0068250949366324785,4,0.30718567833756427,0.30718856321522864,200,results_td3_model1/optuna_phase2/trial_23.yaml,COMPLETE
24,38.907210597418725,2026-05-26 04:07:58.159688,2026-05-26 04:50:29.531669,0 days 00:42:31.371981,128,100000,1.4253998397046035,0.9874163780876114,8,3.5076696828605805e-05,1000,4,0.25038739098282314,normal,1,1024,256,512.0,512.0,1024,1024,1024.0,512.0,4,0.008813918163654856,4,0.38477168752616636,0.33705702957542866,200,results_td3_model1/optuna_phase2/trial_24.yaml,COMPLETE
25,8.091765689023305,2026-05-26 04:50:29.535127,2026-05-26 05:30:21.439739,0 days 00:39:51.904612,128,100000,1.4975615948705008,0.9650179188933478,1,1.793334055902945e-05,1000,3,0.30818046073872846,normal,1,1024,256,512.0,,1024,1024,64.0,,3,0.016305636271452536,4,0.38849168936318706,0.378793856616199,150,results_td3_model1/optuna_phase2/trial_25.yaml,COMPLETE
26,18.898091318143997,2026-05-26 05:30:21.445539,2026-05-26 06:20:55.114428,0 days 00:50:33.668889,128,100000,1.3851304137327314,0.9738281775757297,8,3.082791522714432e-05,5000,4,0.2528505138655638,ou,1,1024,256,128.0,512.0,64,1024,128.0,1024.0,3,0.008467247517712488,4,0.4978028271369133,0.23989558024527408,200,results_td3_model1/optuna_phase2/trial_26.yaml,COMPLETE
27,18.774156633066013,2026-05-26 06:20:55.121976,2026-05-26 07:09:48.589801,0 days 00:48:53.467825,512,100000,1.4430534206709684,0.9630288520165967,8,1.4834972497722282e-05,1000,3,0.1880163561542133,normal,1,1024,256,64.0,,256,1024,256.0,,4,0.005483920053010894,4,0.4224612497177021,0.19981370951076333,200,results_td3_model1/optuna_phase2/trial_27.yaml,COMPLETE
28,12.658679009473417,2026-05-26 07:09:48.591434,2026-05-26 08:07:16.916609,0 days 00:57:28.325175,1024,100000,1.3843655614247767,0.9848812205350628,8,1.0108092971863671e-05,1000,4,0.30687571854635015,normal,1,64,64,256.0,512.0,1024,128,1024.0,128.0,4,0.01022879366188388,8,0.34867359000904663,0.2865265437058301,200,results_td3_model1/optuna_phase2/trial_28.yaml,COMPLETE
29,8.776156680018175,2026-05-26 08:07:16.922314,2026-05-26 08:52:16.330608,0 days 00:44:59.408294,128,100000,1.3023420981726184,0.9705206989492854,1,2.3319966675446214e-05,1000,3,0.131732901621273,normal,1,64,128,512.0,,1024,1024,1024.0,,4,0.007540640204554568,1,0.48778601418011536,0.41613989941706675,150,results_td3_model1/optuna_phase2/trial_29.yaml,COMPLETE
